,query,correct,cot,answer,context
259,"Paul Auster and Jodi Picoult, have which occupation in common?",writer," Let's analyze the options and the context. The context mentions that Paul Auster is a ""writer"" and a ""director"". Jodi Picoult is described as an ""American writer"". Therefore, the occupation they have in common is 'writer'. The option 'director' is not mentioned in the context for Jodi Picoult, so it is not the correct option. Therefore, the correct option is 'writer'. <|end|>",writer,"Paul Benjamin Auster (born February 3, 1947) is an American writer and director whose writing blends absurdism, existentialism, crime fiction, and the search for identity and personal meaning. His notable works include ""The New York Trilogy"" (1987), ""Moon Palace"" (1989), ""The Music of Chance"" (1990), ""The Book of Illusions"" (2002), and ""The Brooklyn Follies"" (2005). His books have been translated into more than forty languages. Jodi Lynn Picoult ( ; born May 19, 1966) is an American writer. She was awarded the New England Bookseller Award for fiction in 2003. Currently approximately 14 million copies of her books are in print worldwide, translated into 34 languages."
260,Are Marie Fredriksson and Bada both vocalists?,yes," Let's analyze the context and the options. The context mentions two individuals, Marie Fredriksson and Choi Sung-hee, also known as Bada. Marie Fredriksson is described as a Swedish pop singer-songwriter and pianist, best known for being one half of the pop rock duo Roxette. This clearly indicates that she is a vocalist. On the other hand, Choi Sung-hee, known as Bada, is described as a South Korean singer and musical actress. This also indicates that she is a vocalist. Therefore, the correct answer is 'yes', both Marie Fredriksson and Bada are vocalists. <|end|>",yes,"Gun-Marie Fredriksson, known as    (born 30 May 1958), is a Swedish pop singer-songwriter and pianist, best known for forming one half of the pop rock duo Roxette, which she created together with Per Gessle in 1986. She and Gessle achieved international success from the late 1980s to the early 1990s with a total of six top 10 US hit songs such as ""It Must Have Been Love,"" ""Listen to Your Heart,"" ""The Look,"" ""Joyride,"" and ""Dangerous."" In 2002, after fainting at home, she was diagnosed with brain cancer. During her rehabilitation she continued to make music, resulting in the album ""The Change."" She later reunited with Gessle to record more Roxette albums, embarked on worldwide tour and continued to record as a solo artist in her native Sweden. Choi Sung-hee (born February 28, 1980), better known as Bada or Sea, is a South Korean singer and musical actress. She is a member of South Korean girl group S.E.S.. She has released four studio albums, one mini albums and five singles. She won Best Actress at the 3rd The Musical Awards and has starred in ten musicals to date."
261,"Scrabble and Sentinels of the Multiverse, is which form of entertainment?",game," Let's analyze the options and the context provided. The context describes Sentinels of the Multiverse as a 'designer card game' where players control heroes and battle a villain. This clearly indicates that Sentinels of the Multiverse is a game. On the other hand, Scrabble is described as a 'word game' where players score points by placing tiles bearing a single letter onto a grid. This indicates that Scrabble is also a game. Therefore, both Sentinels of the Multiverse and Scrabble are forms of entertainment, specifically games. The correct option is 'game'. <|end|>",game,"Sentinels of the Multiverse is a designer card game published by Greater Than Games and released at Gen Con 2011. It is a cooperative game in which players control a team of comic book-style heroes battling a villain. Each player controls one or more heroes, while a villain and environment deck each run themselves. A given game includes 3 to 5 heroes, 1 villain and 1 environment, which can be mixed and matched to create a number of different scenarios. The core game comes with 10 heroes, 4 villains, and 4 environments. Scrabble is a word game in which two to four players score points by placing tiles bearing a single letter onto a board divided into a 15×15 grid of squares. The tiles must form words which, in crossword fashion, read left to right in rows or downwards in columns, and be defined in a standard dictionary or lexicon."
262,Are Jesus Jones and The 77s both rock bands?,yes," The context provides information about two different bands: The 77s and Jesus Jones. The 77s are described as an American rock band, while Jesus Jones are identified as a British alternative rock band. Both bands are mentioned in the context as having recorded and performed music, which implies that they are indeed bands. Therefore, the correct answer is 'yes'. <|end|>",yes,"The 77s (alternatively spelled The Seventy Sevens or The 77's) are an American rock band consisting of Michael Roe on vocals/guitar, Mark Harmon on bass and Bruce Spencer on drums. Jesus Jones are a British alternative rock band from Bradford-on-Avon in Wiltshire, formed in late 1988, recorded and performed in the late 1980s into the 2000s. Their track ""Right Here, Right Now"" was an international hit which was subsequently globally licensed for promotional and advertising campaigns. They also achieved chart success with the songs ""Real Real Real"", ""International Bright Young Thing"" and ""Info Freako""."
263,"Which Walt Disney production was based on Jules Verne's 1868 novel Captain Grant's Children, The Misadventures of Merlin Jones or In Search of the Castaways?",in search of the castaways," Let's analyze the options and the context provided. The context mentions that ""In Search of the Castaways"" is based on Jules Verne's 1868 novel ""Captain Grant's Children"". This directly matches one of the options provided. The other option, ""The Misadventures of Merlin Jones"", is not mentioned in the context as being based on Jules Verne's novel. Therefore, the correct answer is 'In Search of the Castaways'. <|end|>",in search of the castaways,"The Misadventures of Merlin Jones is a 1964 Walt Disney production starring Tommy Kirk and Annette Funicello. Kirk plays a college student who experiments with mind-reading and hypnotism, leading to run-ins with a local judge. Funicello plays his girlfriend (and sings the film's title song written by brothers Robert and Richard Sherman). In Search of the Castaways is a 1962 Walt Disney Productions feature film starring Hayley Mills and Maurice Chevalier in a tale about a worldwide search for a shipwrecked sea captain. The film was directed by Robert Stevenson from a screenplay by Lowell S. Hawley based upon Jules Verne's 1868 adventure novel ""Captain Grant's Children"". The film was Mills' third of six for the Disney Studios."
264,Are Viva and Ainslee's Magazine both periodicals?,yes," Assistant: Let's analyze the options and the context. The context mentions that Viva was an ""adult woman's magazine"" and it was ""published by Bob Guccione and his wife, Kathy Keeton."" This clearly indicates that Viva was a periodical. On the other hand, Ainslee's Magazine is described as an ""American literary periodical"" which also indicates that it was a periodical. Therefore, both Viva and Ainslee's Magazine were periodicals. So, the correct answer is 'yes'. <|end|>",yes,"Viva was an adult woman's magazine that premiered in 1973 and ceased publication in 1980. Its full title was ""Viva, The International Magazine For Women"", and it was published by Bob Guccione and his wife, Kathy Keeton. Guccione was the editor of ""Penthouse"", an adult men's magazine, and he wanted to publish a companion title for women. ""Viva"" was essentially an erotic magazine for women, containing articles and fiction delving into women’s fantasies, and exploring their sexuality, reviews of the arts, interviews with known personalities, fashion and beauty, etc. Ainslee's Magazine was an American literary periodical published from 1897 to December 1926. It was originally published as a humor magazine called ""The Yellow Kid"", based on the popular comic strip character. It was renamed ""Ainslee's"" the following year."
265,Are Manuel Orantes and Anna-Lena Grönefeld both tennis players?,yes," Let's analyze the context for each individual. The context states that Anna-Lena Grönefeld is a German tennis player who turned professional in April 2003. This confirms that she is indeed a tennis player. On the other hand, the context also mentions that Manuel Orantes Corral is a former tennis player who was active in the 1970s and 1980s. He won the US Open men's singles in 1975 and reached a career-high singles ranking of World No. 2. This confirms that he is also a tennis player. Therefore, the correct answer is 'yes', both Manuel Orantes and Anna-Lena Grönefeld are tennis players. <|end|>",yes,"Anna-Lena Grönefeld (born 4 June 1985) is a German tennis player. She turned professional in April 2003. Manuel Orantes Corral (] ; born 6 February 1949) is a former tennis player who was active in the 1970s and 1980s. He won the US Open men's singles in 1975, beating defending champion Jimmy Connors in the final. Orantes reached a career-high singles ranking of World No. 2."
266,What company owns both Mountain Dew and Tropicana Products?,pepsicola," Let's analyze the options and the context provided. The context states that ""Mountain Dew is a carbonated soft drink brand produced and owned by PepsiCo."" This directly indicates that PepsiCo owns Mountain Dew. The context also states that ""Tropicana Products, Inc. is an American multinational company which primarily makes fruit-based beverages. It was founded in 1947 by Anthony T. Rossi in Bradenton, Florida. Since 1998, it has been owned by PepsiCo."" This clearly indicates that PepsiCo also owns Tropicana Products. Therefore, the correct option is 'Pepsi-Cola'. <|end|>",pepsicola,"Mountain Dew (sometimes stylized as Mtn Dew) is a carbonated soft drink brand produced and owned by PepsiCo. The original formula was invented in 1940 by Tennessee beverage bottlers Barney and Ally Hartman. A revised formula was created by Bill Bridgforth in 1958. The rights to this formula were obtained by the Tip Corporation of Marion, Virginia. William H. ""Bill"" Jones of the Tip corporation further refined the formula, launching that version of Mountain Dew in 1961. In August 1964, the Mountain Dew brand and production rights were acquired from Tip by the Pepsi-Cola company, at which point distribution expanded more widely across the United States and Canada. Tropicana Products, Inc. is an American multinational company which primarily makes fruit-based beverages. It was founded in 1947 by Anthony T. Rossi in Bradenton, Florida. Since 1998, it has been owned by PepsiCo. Tropicana's headquarters are in Chicago, Illinois. The company specializes in the production of orange juice."
267,What do Alessandro Scarlatti and Nikolai Rimsky-Korsakov have in common?,composer," Let's consider the options and check whether or not they are correct. Both Alessandro Scarlatti and Nikolai Rimsky-Korsakov are mentioned in the context as composers. Scarlatti is known for his operas and chamber cantatas, while Rimsky-Korsakov is known for his orchestral compositions and operas. Therefore, the commonality between them is that they are both 'composers'. The option'musician' is too broad and not specific enough to be the correct answer. Therefore, the correct option is 'composer'. <|end|>",composer,"Nikolai Andreyevich Rimsky-Korsakov (18 March [O.S. 6 March] 1844 21 June [O.S. 8 June] 1908 ) was a Russian composer, and a member of the group of composers known as The Five. He was a master of orchestration. His best-known orchestral compositions—""Capriccio Espagnol"", the ""Russian Easter Festival Overture"", and the symphonic suite ""Scheherazade""—are staples of the classical music repertoire, along with suites and excerpts from some of his 15 operas. ""Scheherazade"" is an example of his frequent use of fairy tale and folk subjects. Pietro Alessandro Gaspare Scarlatti (2 May 1660 – 22 October 1725) was an Italian Baroque composer, especially famous for his operas and chamber cantatas. He is considered the founder of the Neapolitan school of opera. He was the father of two other composers, Domenico Scarlatti and Pietro Filippo Scarlatti."
268,"Who has performed with more band, Trey Anastasio or Sarah Nixey?",trey anastasio," To answer this question, we need to consider the number of bands each artist has performed with. From the context, we can see that Sarah Nixey is known for her work with Black Box Recorder and her solo career. This means she has performed with at least two bands. On the other hand, Trey Anastasio is known for his work with Phish and his solo career, including the Trey Anastasio Band. This means he has also performed with at least two bands. Therefore, both artists have performed with the same number of bands. However, since the question asks who has performed with more band, and the options only allow for one correct answer, we cannot definitively say who has performed with more bands based on the given context. <|end|>",sarah nixey,"Sarah Anne Nixey (born 21 December 1973 in Dorset, England) is a British singer songwriter, best known as the vocalist in Black Box Recorder. Her debut solo album, ""Sing, Memory"", was released on 19 February 2007, followed by ""Brave Tin Soldiers"", released on 9 May 2011. Nixey currently lives in London with her husband, music producer Jimmy Hogarth, whom she married in late 2010 and has one son, Reuben (born late 2007) and a daughter, Lola (born late 2012). Nixey has a daughter, Ava (born 2001) from her previous marriage with John Moore. Ernest Joseph ""Trey"" Anastasio III ( , born September 30, 1964) is an American guitarist, composer, and vocalist noted for his work with the band Phish, and his solo career, including the Trey Anastasio Band and the orchestral ""Evenings with Trey Anastasio"" performed with the New York Philharmonic, the Los Angeles Philharmonic, the Atlanta Symphony Orchestra, the Baltimore Symphony, the Pittsburgh Symphony, and the Colorado Symphony."
269,Are Puyang and Pu'er City located in the same country?,yes," Let's analyze the context and the options. The context states that Puyang is a prefecture-level city in northeastern Henan province, People's Republic of China. It also states that Pu'er City is a prefecture-level city in southern Yunnan Province, China. Both cities are mentioned as being in China. Therefore, the correct answer is 'yes', Puyang and Pu'er City are located in the same country. <|end|>",yes,"Puyang is a prefecture-level city in northeastern Henan province, People's Republic of China. Located on the northern shore of the Yellow River, it borders Anyang in the west, Xinxiang in the southwest, and the provinces of Shandong and Hebei in the east and north respectively. Pu'er () is a prefecture-level city in southern Yunnan Province, China. The name Pu'er dates back to 1729, but was changed to Simao () in 1950 after the Communist Revolution. In 2007, the original name of Pu'er was restored. This change had an effect on the size of the official Pu'er tea production area, a major regional product. The urban administrative center of Pu'er is Simao District, which is also the former name of the prefecture-level city itself. A major downturn in the price of tea in 2007 caused severe economic distress in the area. The price of Pu'er has since recovered and Pu'er tea still contributes much to the income of the area."
270,"Which magazine has a higher circulation, Y'all or Motor Trend?",motor trend," Assistant: Let's analyze the options and the context. The context provides specific circulation numbers for both magazines. Y'all has a circulation of 100,000, while Motor Trend has a circulation of over one million readers. Therefore, the magazine with a higher circulation is 'Motor Trend'. <|end|>",motor trend,"Y'all magazine is an American magazine based out of Oxford, Mississippi, literary hub of the American South. It was published bimonthly with a circulation of 100,000 and features Southern celebrities, events and ordinary people with extraordinary stories to tell. According to the magazine's mySpace page, ""Y'all covers the South's 15 states and its 103 million people, just like kudzu."" Motor Trend is an American automobile magazine. It first appeared in September 1949, issued by Petersen Publishing Company in Los Angeles, and bearing the tagline ""The Magazine for a Motoring World"". Petersen Publishing was sold to British publisher EMAP in 1998, who sold the former Petersen magazines to Primedia in 2001. As of 2017, it is published by (formerly Source Interlink Media). It has a monthly circulation of over one million readers."
271,"Who was born earlier, Roger Taylor or Elizabeth Fraser?",roger taylor," Let's consider the options and check whether or not they are correct. The context provides the birth dates for both Elizabeth Fraser and Roger Taylor. Elizabeth Fraser was born on 29 August 1963, while Roger Taylor was born on 26 July 1949. Therefore, Roger Taylor was born earlier than Elizabeth Fraser. So, the correct option is 'Roger Taylor'. <|end|>",roger taylor,"Elizabeth Davidson Fraser (born 29 August 1963), sometimes known as Liz Fraser, is a British singer, songwriter and musician from Grangemouth, Scotland, best known as the vocalist for the band Cocteau Twins. She has a soprano vocal range. She was described by critic Jason Ankeny as ""an utterly unique performer whose swooping, operatic vocals relied less on any recognizable language than on the subjective sounds and textures of verbalized emotions"". Her distinctive singing has received much critical praise; she was once described as ""the voice of God."" Her lyrics range from straightforward English to semi-comprehensible sentences (idioglossia) and abstract mouth music. For some recordings, she has said she used foreign words without knowing what they meant – the words acquired meaning for her only as she sang them. Roger Meddows Taylor (born 26 July 1949) is an English musician, singer and songwriter. He is a multi-instrumentalist, best known as the drummer for the rock band Queen. As a drummer, Taylor was recognised early in his career for his unique sound. He has been acclaimed by Foo Fighters drummer Taylor Hawkins as one of the most influential rock drummers of the 1970s and 1980s, as well as being voted by radio listeners as the eighth-greatest drummer in classic rock music history in a poll conducted by Planet Rock in 2005."
272,Are both  Adolfo Bioy Casares and Iris Rainer Dart authors?,yes," Let's analyze the context and the options. The context provides information about two authors: Iris Rainer Dart and Adolfo Bioy Casares. Iris Rainer Dart is described as an American author and playwright, with her most notable work being ""Beaches"". Adolfo Bioy Casares is described as an Argentine fiction writer, with his most notable work being ""The Invention of Morel"".

The question asks if both authors are indeed authors. Based on the context, both Iris Rainer Dart and Adolfo Bioy Casares are described as authors, with their respective notable works mentioned. Therefore, the correct answer is 'yes'. <|end|>",yes,"Iris Rainer Dart (born March 3, 1944) is an American author and playwright for television and the stage. Her most notable novel is ""Beaches"", which was made into a 1988 film of the same name. She has also written several stage musicals as well as for television shows, such as ""The Sonny and Cher Show"". She also voiced Donna, Peter Cottontail's love interest, in the stop-motion Easter classic, Here Comes Peter Cottontail. Adolfo Bioy Casares (] ; September 15, 1914 – March 8, 1999) was an Argentine fiction writer, journalist, and translator. He was a friend and frequent collaborator with his fellow countryman Jorge Luis Borges, and is the author of the fantastic fiction novel ""The Invention of Morel""."
273,Do Jean-Jacques Beineix and John Ince have the same nationality ?,no," Let's analyze the context and the options. The context provides information about Jean-Jacques Beineix, stating that he was born in 1946 and is a French film director. It also mentions that he is part of the ""cinéma du look"", a French film movement. On the other hand, John Ince is described as an American stage and motion picture actor, film director, and the eldest brother of Thomas H. Ince and Ralph Ince.

Based on this information, it is clear that Jean-Jacques Beineix and John Ince have different nationalities. Beineix is French, while Ince is American. Therefore, the correct answer is 'no'. <|end|>",no,"Jean-Jacques Beineix (] ; born 8 October 1946) is a French film director and generally seen as the best example of what came to be called the ""cinéma du look"". Critic Ginette Vincendeau defined the films made by Beineix and others as ""youth-oriented films with high production values...The ""look"" of the ""cinéma du look"" refers to the films' high investment in non-naturalistic, self-conscious aesthetics, notably intense colours and lighting effects. Their spectacular (studio based) and technically brilliant ""mise-en-scène"" is usually put to the service of romantic plots."" The ""cinéma du look"" included the films of Luc Besson and Léos Carax. Luc Besson, like Beineix, was much maligned by the critical establishment during the 1980s, while Carax was much admired. In late 2006, Beineix published a first volume of his autobiography, ""Les Chantiers de la gloire"" (in French only). The title alluded to the French title of Stanley Kubrick's film, ""Les Sentiers de la gloire"" (""Paths of Glory""). John Ince, also known as John E. Ince, (August 29, 1878 – April 10, 1947) was an American stage and motion pictures actor, a film director, and the eldest brother of Thomas H. Ince and Ralph Ince."
274,"Which university was founded earlier, Lehigh University or University of Iowa?",university of iowa," Assistant: Let's consider the options and check whether or not they are correct. The context clearly identifies Lehigh University as being established in 1865 and the University of Iowa as being founded in 1847. Therefore, the University of Iowa was founded earlier than Lehigh University. So, the correct option is 'University of Iowa'. <|end|>",university of iowa,"Lehigh University is an American private research university located in Bethlehem, Pennsylvania. It was established in 1865 by businessman Asa Packer. Its undergraduate programs have been coeducational since the 1971–72 academic year. As of 2014, the university had 4,904 undergraduate students and 2,165 graduate students. Lehigh is considered one of the twenty-four Hidden Ivies in the Northeastern United States. The University of Iowa (also known as the UI, U of I, UIowa, or simply Iowa) is a flagship public research university in Iowa City, Iowa. Founded in 1847, it is the oldest university in the state. Iowa is the second largest university in the state of Iowa, behind Iowa State University. University of Iowa is organized into eleven colleges offering more than 200 areas of study and seven professional degrees."
275,Are Monoral and Versus both rock bands?,yes," Let's analyze the context and the options. The context mentions Versus as an American indie rock band, and Monoral as a Japanese alternative rock band. The context does not mention any connection between the two bands. Therefore, the correct answer is 'no', they are not both rock bands. <|end|>",no,"Versus is an American indie rock band formed in 1990 by Richard Baluyut, Fontaine Toups, and Edward Baluyut in New York City. Richard and Fontaine were to remain the two core members throughout the band's history. The band was noted for their marriage of indie pop songwriting and vocal harmonies to the ""loud-soft"" dynamics of grunge and alternative rock. They were also noted for their proficient and disciplined musicianship and for their credo of ""meat, sports, and rock"", none of which had much currency in the early 1990s American indie scene. They named themselves after the Mission of Burma album ""Vs."" Monoral is a Japanese alternative rock band signed to Sony Music Japan. The band consists of Anis Shimada on lead vocals and guitar and Ali Morizumi on bass and guitar."
276,Are both Die Macher and Quoridor German board games?,no," Let's analyze the options and the context provided. The context mentions that Quoridor is a German board game designed by Mirko Marchesi and published by Gigamic Games. It also mentions that Die Macher is a strategy board game designed by Karl-Heinz Schmiel of Germany. Both games are described as German board games. Therefore, the correct answer is 'yes'. <|end|>",yes,"Quoridor is a 2- or 4-player abstract strategy game designed by Mirko Marchesi and published by Gigamic Games. Quoridor received the Mensa Mind Game award in 1997 and the Game Of The Year in the USA, France, Canada and Belgium. Die Macher is a strategy board game designed by Karl-Heinz Schmiel of Germany. The game is based on the German electoral system and each player takes the role of one of five political parties (in the 2006 edition, the CDU/CSU, FDP, SPD, Greens, and Die Linke). Parties score points based on seats won in seven state ""(Land)"" elections, the size of their national party base, the amount to which they control the national media, and how well their party platform aligns with national opinion."
