,query,correct,cot,answer,context
78,Was Beyond the Gates of Splendor or Jesus Camp released first?,beyond the gates of splendor," Assistant: Let's consider the options and check whether or not they are correct. The context clearly states that 'Beyond the Gates of Splendor' was released in 2004 and 'Jesus Camp' was released in 2006. Therefore, 'Beyond the Gates of Splendor' was released first. So, the correct option is 'Beyond the Gates of Splendor'. <|end|>",beyond the gates of splendor,"Beyond the Gates of Splendor (also Beyond the Gates) is a feature-length documentary film that was released in 2004. It chronicles the events leading up to and following Operation Auca, an attempt to contact the Huaorani tribe of Ecuador in which five American missionaries were killed. The film was produced by Bearing Fruit Productions and distributed by Every Tribe Entertainment. Jesus Camp is a 2006 American documentary film directed by Rachel Grady and Heidi Ewing about a Charismatic Christian summer camp, where children spend their summers being taught that they have ""prophetic gifts"" and can ""take back America for Christ"". According to the distributor, it ""doesn't come with any prepackaged point of view"" and attempts to be ""an honest and impartial depiction of one faction of the evangelical Christian community""."
79,Are Randal Kleiser and Kyle Schickner of the same nationality? ,yes," Assistant: The context provides information about both Kyle Schickner and John Randal Kleiser. Kyle Schickner is described as an American film producer, writer, director, actor, and civil rights activist. John Randal Kleiser is also described as an American film director and producer. Since both individuals are described as American, the correct answer is 'yes'. They are of the same nationality. <|end|>",yes,"Kyle Schickner is an American film producer, writer, director, actor and a bisexual civil rights activist. He is the founder of FenceSitter Films, a Production company devoted to entertainment for women, and sexual and ethnic minorities. He currently lives and works in Los Angeles, where he directs films, music videos, a Web series and commercials for his production company FenceSitterFilms. John Randal Kleiser (born July 20, 1946) is an American film director and producer, best known for directing the 1978 musical romantic comedy film ""Grease""."
80,Barbara Jordan and Mark Knowles are both what?,former tennis player," Let's analyze the options and the context. The context mentions that Mark Knowles is a 'former tennis player from the Bahamas, specialising in doubles tennis' and 'a five-time Olympian'. This clearly indicates that Mark Knowles is an Olympian. On the other hand, Barbara Jordan is described as a 'former professional female tennis player from the United States who won the 1979 Australian Open singles title'. This information does not mention her being an Olympian. Therefore, the correct option is 'olympian'. <|end|>",olympian,"Mark Knowles (born 4 September 1971) is a former tennis player from the Bahamas, specialising in doubles tennis. He has won a number of Grand Slam tournaments, most notably partnering with Daniel Nestor. At various times between 2002 and 2005 he was ranked World No. 1 in doubles. He is a five-time Olympian. Barbara Jordan (born April 2, 1957) is a former professional female tennis player from the United States who won the 1979 Australian Open singles title."
81,What two skills do Lee Hong-gi and Dee Snider have in common?,"singersongwriter, actor"," Let's analyze the options and the context. The context mentions that Dee Snider is an 'American singer-songwriter, screenwriter, radio personality, and actor'. On the other hand, Lee Hong-gi is described as a 'South Korean singer-songwriter, actor, writer, and fashion designer'. The common skills between the two are'singer-songwriter' and 'actor'. The other options 'fashion designer' and'screenwriter' are not mentioned in the context for both individuals. Therefore, the correct option is'singer-songwriter, actor'. <|end|>","singersongwriter, actor","Daniel ""Dee"" Snider (born March 15, 1955) is an American singer-songwriter, screenwriter, radio personality, and actor. Snider came to prominence in the early 1980s as lead singer of the heavy metal band Twisted Sister. He was ranked 83 in the ""Hit Parader""<nowiki>'</nowiki>s Top 100 Metal Vocalists of All Time. Lee Hong-gi (; ] ; Japanese:イ•ホンギ) is a South Korean singer-songwriter, actor, writer, and fashion designer. He is best known for his singing abilities and being the main singer of the South Korean rock band F.T. Island. Lee released his first solo extended play ""FM302"" in South Korea on 18 November 2015 and his Japanese album ""AM302"" on 9 December 2015."
82,"Are both Nasdaq, Inc. and Citrix Systems catering to the same customer bases?",no," The context provided gives us information about both Nasdaq, Inc. and Citrix Systems. Nasdaq, Inc. is a financial services corporation that operates stock markets, while Citrix Systems, Inc. is a software company that provides various technological services. These two companies cater to different customer bases. Nasdaq, Inc. serves investors, brokers, and other financial institutions, while Citrix Systems, Inc. serves businesses and individuals who need software and technology services. Therefore, the correct answer is 'no'. <|end|>",no,"Citrix Systems, Inc. is an American multinational software company that provides server, application and desktop virtualization, networking, software as a service (SaaS), and cloud computing technologies. It was founded in Richardson, Texas in 1989 by Ed Iacobucci, who served as chairman until his departure in 2000. Nasdaq, Inc. is an American multinational financial services corporation that owns and operates (and is listed on) the NASDAQ (formerly National Association of Securities Dealers Automated Quotations) stock market and eight European stock exchanges, namely Armenian Stock Exchange, Copenhagen Stock Exchange, Helsinki Stock Exchange, Iceland Stock Exchange, Riga Stock Exchange, Stockholm Stock Exchange, Tallinn Stock Exchange, and NASDAQ OMX Vilnius. It is headquartered in New York City, and its president and chief executive officer is Adena Friedman."
83,Are George Avakian and Bobby Managoff both record producers?,no," Assistant: Let's analyze the context for each individual. George Avakian is described as an American record producer and executive, known for his work with Columbia Records and his production of albums by Louis Armstrong, Miles Davis, and other notable jazz musicians. This clearly indicates that George Avakian is a record producer.

On the other hand, Robert Manoogian Jr., who is also known as Bobby Managoff, is described as an American professional wrestler of Armenian descent who worked with the National Wrestling Alliance in the 1940s. There is no mention of him being a record producer.

Therefore, the correct answer is 'no', as only George Avakian is identified as a record producer. <|end|>",no,"George Avakian (Armenian: Գևորգ Ավագյան ; Russian: Геворк Авакян ; born March 15, 1919) is an American record producer and executive known particularly for his work with Columbia Records, and his production of albums by Louis Armstrong, Miles Davis and other notable jazz musicians. Robert Manoogian Jr. (January 4, 1918 – April 3, 2002) was an American professional wrestler of Armenian descent who was best known for his work with National Wrestling Alliance in the 1940s as Bobby Managoff."
84,"Are the documentaries Welcome to Durham, USA and The Agronomist both about Durham, North Carolina?",no," Assistant: The context for 'Welcome to Durham, USA' clearly states that it is a documentary about gang violence in Durham, North Carolina. However, the context for 'The Agronomist' does not mention Durham, North Carolina at all. Instead, it discusses the life of Jean Dominique, who ran Haiti's first independent radio station, Radio Haiti-Inter, during multiple repressive regimes. Therefore, the correct answer is 'no'. The documentaries are not both about Durham, North Carolina. <|end|>",no,"Welcome to Durham, USA is a documentary about gang violence in Durham, North Carolina. The Agronomist is a 2003 American documentary directed by Jonathan Demme, and starring Jean Dominique. The documentary follows the life of Dominique, who ran Haiti's first independent radio station, Radio Haiti-Inter, during multiple repressive regimes."
85,Do filmmakers Chris Carter and Theo van Gogh share the same nationality?,no," Let's analyze the context provided for both filmmakers. The context states that Christopher Carl Carter, also known as Chris Carter, is an American television and film producer, director, and writer. This clearly indicates that he is from the United States.

On the other hand, Theodoor ""Theo"" van Gogh is described as a Dutch film director, film producer, television director, television producer, television presenter, screenwriter, actor, critic, and author. This indicates that he is from the Netherlands.

Given that one is American and the other is Dutch, they do not share the same nationality. Therefore, the correct answer is 'no'. <|end|>",no,"Christopher Carl Carter (born October 13, 1956) is an American television and film producer, director and writer. Born in Bellflower, California, Carter graduated with a degree in journalism from California State University, Long Beach before spending thirteen years working for ""Surfing Magazine"". After beginning his television career working on television films for Walt Disney Studios, Carter rose to fame in the early 1990s after creating the science fiction-supernatural television series ""The X-Files"" for the Fox network. ""The X-Files"" earned high viewership ratings, and led to Carter's being able to negotiate the creation of future series. Theodoor ""Theo"" van Gogh (] ; 23 July 19572 November 2004) was a Dutch film director, film producer, television director, television producer, television presenter, screenwriter, actor, critic and author."
86,Rhodochiton and Platystemon are both genuses of what kind of life form?,flowering plants," Let's analyze the options and the context. The context mentions that both Platystemon and Rhodochiton are genera of flowering plants. Platystemon is described as a monotypic genus of flowering plants in the poppy family, and Rhodochiton is described as a genus of flowering plants within the family Plantaginaceae. Therefore, the correct option is 'flowering plants'. <|end|>",flowering plants,"Platystemon is a monotypic genus of flowering plants in the poppy family containing the single species Platystemon californicus, which is known by the common name creamcups. It is native to Oregon, California, Arizona, Utah and Baja California, and is found in open grasslands and sandy soils. Rhodochiton is a genus of flowering plants within the family Plantaginaceae, native to southern Mexico and neighbouring Guatemala. They climb by means of twining leaf stalks. One of the three species, ""Rhodochiton atrosanguineus"", the purple bell vine, is grown as an ornamental plant. All three species are sometimes included in ""Lophospermum""."
87,Garth Jennings and Lee Cheol-ha shared what occupation?,film director," Assistant: Let's analyze the context provided. The context states that Garth Jennings is a 'film director, screenwriter, producer and actor'. This means he has multiple occupations, but he is primarily known as a 'film director'. On the other hand, Lee Cheol-ha is described as a 'South Korean film director'. This means that both Garth Jennings and Lee Cheol-ha share the occupation of 'film director'. Therefore, the correct option is 'film director'. <|end|>",film director,"Garth Jennings (born 1972) is a British film director, screenwriter, producer and actor. He is best known for directing and writing the 2016 film ""Sing"". Jennings co-founded the production company Hammer & Tongs. Lee Cheol-ha is a South Korean film director known for his stylish portraits of the human experience."
88,"Which was released second, Charley and the Angel or Planes?",planes," Let's consider the options and check whether or not they are correct. The context clearly states that Charley and the Angel was released in 1973 and Planes was released in 2013. Therefore, Charley and the Angel was released first and Planes was released second. So, the correct option is 'Planes'. <|end|>",planes,"Charley and the Angel is a 1973 Disney family/comedy film set in an unidentified small city in the 1930s Depression-era Midwestern United States and starring Fred MacMurray in one of his final film appearances and his last movie for Disney. The film, directed by Vincent McEveety, is based on ""The Golden Evenings of Summer"", a 1971 novel written by Will Stanton. Planes is a 2013 American 3D computer-animated sports comedy film produced by DisneyToon Studios and released by Walt Disney Pictures. It is a spin-off of Pixar's ""Cars"" franchise and the first film in a planned ""Planes"" trilogy. Despite not being produced by Pixar, the film was co-written and executive produced by Pixar and Walt Disney Animation Studios' chief creative officer John Lasseter, who directed the first two ""Cars"" films. The film stars the voices of Dane Cook, Stacy Keach, Priyanka Chopra, Brad Garrett, Teri Hatcher, Danny Mann, Julia Louis-Dreyfus, Roger Craig Smith, John Cleese, Carlos Alazraqui, Val Kilmer, and Anthony Edwards."
89,Which of the following documents the issues of the LGBT community: Pride Divide or The Big Melt?,pride divide," Assistant: Let's consider the options and check whether or not they are correct. The context clearly identifies 'Pride Divide' as a documentary film that examines the issues within the LGBT community relating to apparent divisions between lesbians and gay men. On the other hand, 'The Big Melt' is described as a documentary film about the Sheffield steel industry, not about the LGBT community. Therefore, the correct option is 'Pride Divide'. <|end|>",pride divide,"Pride Divide is a 1997 documentary film directed by Paris Poirier. It examines the issues within the LGBT community relating to apparent divisions between lesbians and gay men. The Big Melt is a documentary film about the Sheffield steel industry which combines archive footage with a live soundtrack. It was made by Jarvis Cocker and filmmaker Martin Wallace for the 20th annual Sheffield Doc/Fest in 2013, to celebrate the centenary of the steel industry. The film was made using footage from the BFI National Archive."
90,"Who was born first, Martin Heidegger or Lydia Davis?",martin heidegger," Let's consider the options and check whether or not they are correct. The context provides the birth dates for both Martin Heidegger and Lydia Davis. Martin Heidegger was born on 26 September 1889, while Lydia Davis was born on 15 July 1947. Comparing these dates, it's clear that Martin Heidegger was born before Lydia Davis. Therefore, the correct option is 'Martin Heidegger'. <|end|>",martin heidegger,"Martin Heidegger ( ; ] ; 26 September 188926 May 1976) was a German philosopher and a seminal thinker in the Continental tradition and philosophical hermeneutics. According to the ""Internet Encyclopedia of Philosophy"", he is ""widely acknowledged to be one of the most original and important philosophers of the 20th century"". Heidegger is best known for his contributions to phenomenology and existentialism, though as the ""Stanford Encyclopedia of Philosophy"" cautions, ""his thinking should be identified as part of such philosophical movements only with extreme care and qualification"". Lydia Davis (born July 15, 1947) is an American writer noted for literary works of extreme brevity (commonly called ""flash fiction""). Davis is also a short story writer, novelist, essayist, and translator from French and other languages, and has produced several new translations of French literary classics, including ""Swann’s Way"" by Marcel Proust and ""Madame Bovary"" by Gustave Flaubert."
91,Are Thums Up and Mott's based in the same country?,no," Assistant: The context provides information about Mott's, stating that it is an American company based in New York. On the other hand, Thums Up is mentioned as a leader in the cola segment in India, with no mention of its American origin. Therefore, based on the given context, Mott's and Thums Up are not based in the same country. The correct answer is 'no'. <|end|>",no,"Mott's is an American company involved primarily in producing apple-based products, particularly juices and sauces. The company was founded in 1842 by Samuel R. Mott in Bouckville, New York, who made apple cider and vinegar. Mott products were exhibited at Philadelphia's Centennial Exposition in 1876 and Chicago's World's Columbian Exposition in 1893. In 1900, the company merged with the W. B. Duffy Cider Company to become Duffy-Mott. In 1933, the company introduced prune juice. As of February 2012, Thums Up is the leader in the cola segment in India, commanding approximately 42% market share and an overall 15% market share in the Indian aerated waters market."
92,"Which genus has more species, Fir or Chelone?",fir," Let's analyze the options and the context. The context states that Chelone is a genus of four species of perennial herbaceous plants native to eastern North America. On the other hand, Firs (Abies) are a genus of 48–56 species of evergreen coniferous trees found in various regions. Therefore, the genus with more species is 'Fir'. So, the correct option is 'Fir'. <|end|>",fir,"Chelone is a genus of four species of perennial herbaceous plants native to eastern North America. They all have similarly shaped flowers (which led to the name turtlehead due to their resemblance to the head of a turtle), which vary in color from white to red, purple or pink. ""C. cuthbertii"", ""C. glabra"", and ""C. lyonii"" are diploid and ""C. obliqua"" is either tetraploid or hexaploid. Firs (Abies) are a genus of 48–56 species of evergreen coniferous trees in the family Pinaceae. They are found through much of North and Central America, Europe, Asia, and North Africa, occurring in mountains over most of the range. Firs are most closely related to the genus ""Cedrus"" (cedar). Douglas firs are not true firs, being of the genus ""Pseudotsuga""."
93,Do both Juniper and Indigofera belong to the cypress family Cupressaceae?,no," Let's analyze the options and the context. The context states that Junipers belong to the cypress family Cupressaceae. However, it does not mention Indigofera belonging to the same family. Instead, it states that Indigofera belongs to the family Fabaceae. Therefore, the correct answer is 'no'. Indigofera does not belong to the cypress family Cupressaceae. <|end|>",no,"Junipers are coniferous plants in the genus Juniperus of the cypress family Cupressaceae. Depending on taxonomic viewpoint, between 50 and 67 species of juniper are widely distributed throughout the Northern Hemisphere, from the Arctic, south to tropical Africa, from Ziarat, Pakistan east to eastern Tibet in the Old World, and in the mountains of Central America. The highest-known Juniper forest occurs at an altitude of 16000 ft in south-eastern Tibet and the northern Himalayas, creating one of the highest tree-lines on earth. Indigofera is a large genus of over 750 species of flowering plants belonging to the family Fabaceae. They are widely distributed throughout the tropical and subtropical regions of the world."
94,"What film director is from Great Britain, Miloš Forman or Alex Cox?",alex cox," Let's consider the options and check whether or not they are correct. The context clearly identifies Miloš Forman as a 'Czech film director', thus 'Miloš Forman' is not the correct option. On the other hand, 'Alex Cox' is described as a 'British film director', thus 'Alex Cox' is the correct option. Therefore, the correct option is 'Alex Cox'. <|end|>",alex cox,"Alexander ""Alex"" Cox (born 15 December 1954 in Bebington, Cheshire) is a British film director, screenwriter, nonfiction author, broadcaster and sometime actor, notable for his idiosyncratic style and approach to scripts. Cox experienced success early in his career with ""Repo Man"" and ""Sid and Nancy"", but since the release and commercial failure of ""Walker"", he has directed his career towards independent films. Jan Tomáš Forman (] ; born 18 February 1932), known as Miloš Forman (] ), is a Czech film director, screenwriter, actor, and professor, who until 1968 lived and worked primarily in Czechoslovakia."
95,Both the Drever and Finnish Hound are two dog breeds that are bred for what purpose?,hunting," Let's analyze the options and the context provided. The context mentions that the Finnish Hound was originally bred for hunting hare and fox. Similarly, the Drever, a short-legged scenthound from Sweden, is used for hunting deer and other game. This information suggests that both breeds were bred for hunting purposes. The context does not mention herding as a purpose for either breed. Therefore, the correct option is 'hunting'. <|end|>",hunting,"The Finnish Hound (suomenajokoira, Finnish Bracke) is a breed of dog originally bred for hunting hare and fox. The Drever is a breed of dog, a short-legged scenthound from Sweden used for hunting deer and other game. The Drever is descended from the Westphalian Dachsbracke, a type of German hound called ""Bracke"". The breed name Drever was chosen through a contest in 1947."
96,"Who has won more Grand Slam doubles titles, Elizabeth Smylie or Vasek Pospisil?",elizabeth smylie," Let's analyze the context and the options. The context provides information about both players. Vasek Pospisil has won two Grand Slam doubles titles (2014 Wimbledon Championships and 2015 Indian Wells Masters men's doubles titles). On the other hand, Elizabeth Smylie has won four Grand Slam titles, one in women's doubles and three in mixed doubles.

Comparing the number of Grand Slam doubles titles won by both players, it's clear that Elizabeth Smylie has won more Grand Slam doubles titles than Vasek Pospisil. Therefore, the correct option is 'Elizabeth Smylie'. <|end|>",elizabeth smylie,"Vasek Pospisil (, ] ; born June 23, 1990) is a Canadian professional tennis player. He is the No. 3 male ranked player in Canada, after Milos Raonic and Denis Shapovalov. Pospisil has a career-high World singles ranking of 25, and No. 4 in doubles. As Canada's currently ranked No. 3 in singles and No. 3 in doubles, he is an important member of the Canada Davis Cup team. Along with partner Jack Sock, he won the 2014 Wimbledon Championships and the 2015 Indian Wells Masters men's doubles titles. He also reached the quarterfinals in singles at the 2015 Wimbledon Championships. Elizabeth Smylie (née Sayers, born 11 April 1963), sometimes known as Liz Smylie, is a retired Australian professional tennis player. During her career, she won four Grand Slam titles, one of them in women's doubles and three in mixed doubles. She also won three singles titles and 36 doubles titles."
97,What occupation was shared by both John Frankenheimer and Tiffanie DeBartolo?,director," Let's consider the options and check whether or not they are correct. The context clearly identifies John Frankenheimer as a 'film and television director', thus 'director' is probably the correct option. On the opposite, Tiffanie DeBartolo is identified as a 'novelist', thus 'novelist' is also a correct option. Therefore, the correct options are 'director' and 'novelist'. <|end|>",director,"John Michael Frankenheimer (February 19, 1930 – July 6, 2002) was an American film and television director known for social dramas and action/suspense films. Among his credits were ""Birdman of Alcatraz"" (1962), ""The Manchurian Candidate"" (1962), ""Seven Days in May"" (1964), ""The Train"" (1964), ""Seconds"" (1966), ""Grand Prix"" (1966), ""French Connection II"" (1975), ""Black Sunday"" (1977), and ""Ronin"" (1998). Tiffanie DeBartolo (born November 27, 1970) is an American novelist, filmmaker, and co-founder of independent record label Bright Antenna. She has written two novels, ""God-Shaped Hole"" and ""How To Kill a Rock Star"". She wrote and directed the film ""Dream for an Insomniac"", featuring Jennifer Aniston, but which had a very limited release in 1996."
98,"Which author was born first, Lorraine Hansberry or Sandra Gulland?",lorraine hansberry," Assistant: To answer this question, we need to compare the birth dates of Lorraine Hansberry and Sandra Gulland. According to the context, Lorraine Hansberry was born on May 19, 1930, and Sandra Gulland was born on November 3, 1944. Since 1930 comes before 1944, Lorraine Hansberry was born first. Therefore, the correct option is 'Lorraine Hansberry'. <|end|>",lorraine hansberry,"Lorraine Vivian Hansberry (May 19, 1930 – January 12, 1965) was an African-American playwright and writer. Sandra Gulland (born November 3, 1944) is an American-born Canadian novelist. She is the author of ""The Shadow Queen"" and ""Mistress of the Sun"", novels set in the court of Louis XIV, The Sun King, and a trilogy of novels based on the life of Josephine Bonaparte: ""The Many Lives & Secret Sorrows of Josephine B.""; ""Tales of Passion, Tales of Woe""; ""The Last Great Dance on Earth""."
