,query,correct,cot,answer,context
158,"As of 2016, which band released more albums, The Last Shadow Puppets or The Classic Crime?",the classic crime," Let's analyze the context and the options. The context states that The Classic Crime has released three albums and an EP, and as of April 2017, they have released their fifth studio album. On the other hand, The Last Shadow Puppets have released two albums, with their second album released in 2016. Therefore, as of 2016, The Classic Crime released more albums than The Last Shadow Puppets. The correct option is 'The Classic Crime'. <|end|>",the classic crime,"The Classic Crime is an American rock band from Seattle, Washington formed in 2004. The band's current lineup consists of Matt MacDonald (vocals, guitar), Alan Clark (bass), Robert ""Cheeze"" Negrin (guitar), and Paul ""Skip"" Erickson (drums, vocals). They have released three albums and an EP on Tooth & Nail Records, two of which, ""The Silver Cord"" (2008) and ""Vagabonds"" (2010), charted in the ""Billboard"" 200. In July 2011, the band left Tooth & Nail to produce a fourth album with the help of fan donations via Kickstarter, called ""Phoenix"" (2012). In April 2016, The Classic Crime created a Kickstarter to raise funds for a fifth studio album. Within three hours they acquired the necessary $30,000 for the album. On April 28th, 2017 they released their fifth studio album titled ""How to Be Human""(2017). The Last Shadow Puppets are an English supergroup consisting of Alex Turner (Arctic Monkeys), Miles Kane (The Rascals, solo artist), James Ford (Simian, Simian Mobile Disco, music producer), and Zach Dawes (Mini Mansions). They are joined live by Loren Humphrey (Guards, music producer, session musician) and Tyler Parkford (Mini Mansions). The band released their debut album ""The Age of the Understatement"" in 2008. Following a lengthy hiatus, they returned, releasing second album ""Everything You've Come to Expect"" in 2016."
159,What type of vegetation does Cerastium and Pavonia have in common?,plants," Assistant: Let's analyze the options and the context. The context mentions that Pavonia is a genus of flowering plants in the mallow family, Malvaceae. It also mentions that Cerastium is a genus of plants belonging to the family Caryophyllaceae. Both genera are types of plants, so 'plants' is a correct option. However, the context also specifies that Pavonia is a genus of flowering plants, which means 'flowers' is also a correct option. Therefore, both 'flowers' and 'plants' are correct options. <|end|>",flowers,"Pavonia is a genus of flowering plants in the mallow family, Malvaceae. The generic name honours Spanish botanist José Antonio Pavón Jiménez (1754–1844). Several species are known as swampmallows. Cerastium is a genus of annual, winter annual, or perennial plants belonging to the family Caryophyllaceae. They are commonly called mouse-ear chickweed. Species are found nearly worldwide but the greatest concentration is in the northern temperate regions. There are about 200 species. A number are common weeds in fields and on disturbed ground."
160,Are A Tiger Walks and A Kid in King Arthur's Court both family films?,yes," Let's analyze the options and the context. The context mentions that ""A Kid in King Arthur's Court"" is a Disney family film, which directly supports the 'yes' option. On the other hand, ""A Tiger Walks"" is described as a family drama film, but it's not mentioned to be a Disney film. Therefore, it's not clear if it's a family film or not. However, since the question asks if both are family films, and we only have confirmation for one, the correct answer is 'no'. <|end|>",no,"A Kid in King Arthur's Court is a 1995 Disney family film directed by Michael Gottlieb. It is based on the famous Mark Twain novel ""A Connecticut Yankee in King Arthur's Court"" (previously filmed by Disney as ""Unidentified Flying Oddball"" in 1978 in which Ron Moody also played Merlin), transplanted into the twentieth century. Trimark later released a sequel, ""A Kid in Aladdin's Palace"", in 1998, but without Disney's involvement. Since Trimark's dissolution, the sequel is now distributed by Lions Gate Entertainment. A Tiger Walks is a 1964 family drama film, directed by Norman Tokar and produced by Walt Disney Productions. It is based on a novel of the same name by Ian Niall."
161,Are Sparta and King Charles both from the same country?,no," Let's analyze the context and the options. The context tells us that Sparta is a rock band from El Paso, Texas, and King Charles is a singer-songwriter from West London. Texas and London are both in the United States, so it seems that both Sparta and King Charles are from the same country. Therefore, the correct option is 'yes'. <|end|>",yes,"Sparta is an American rock band from El Paso, Texas, formed in 2001. Founding members Jim Ward (vocalist/guitarist) and Tony Hajjar (drummer) are also members of post-hardcore group At the Drive-In. Keeley Davis (guitarist) is the former frontman of Engine Down. King Charles (born Charles Costa, 6 May 1985) is a singer-songwriter from West London."
162,Which city in China is a prefecture-level city Xinzhou or Guanghan,xinzhou," Let's analyze the options and the context. The context states that Xinzhou is a 'prefecture-level city' in Shanxi province, China. On the other hand, Guanghan is described as a 'county-level city' in Deyang, Sichuan province, China. The context does not mention Guanghan as a prefecture-level city. Therefore, the correct option is 'Xinzhou'. <|end|>",xinzhou,"Xinzhou () is a prefecture-level city occupying the north-central section of Shanxi province, People's Republic of China. Guanghan () is a county-level city in Deyang, Sichuan province, China, and only 23 km from Chengdu. The predominant industries are tourism, pharmaceuticals and the supply of building material."
163,Are Braque d'Auvergne and Griffon Fauve de Bretagne both breeds originating in France ?,yes," Assistant: The context provides information about both breeds and their origins. The Braque d'Auvergne is described as originating in the mountain area of Cantal, in the historic Auvergne province in the mid-south of France. The Griffon Fauve de Bretagne is described as originating in the region of Brittany in France. Since both breeds are described as originating in France, the correct answer is 'yes'. <|end|>",yes,"The Braque d'Auvergne is a breed of dog originating in the mountain area of Cantal, in the historic Auvergne province in the mid-south of France. It is a pointer and versatile gundog. The breed descends from ancient regional types of hunting dogs. The Griffon Fauve de Bretagne (FCI No.66) translated into English as the Fawn Brittany Griffon, is a breed of dog of the scenthound type, originating in France in the region of Brittany."
164,"The World's Best Prom and Shape of the Moon, are films of which genre?",documentary," Assistant: Let's analyze the context and the options. The context mentions ""The World's Best Prom"" as a ""2006 documentary film about a high school prom in Racine, Wisconsin."" This clearly indicates that ""The World's Best Prom"" is a documentary film. On the other hand, ""Shape of the Moon"" is described as a ""Dutch/Indonesian documentary film from 2004 directed by Leonard Retel Helmrich."" This also confirms that ""Shape of the Moon"" is a documentary film. Therefore, both films belong to the 'documentary' genre. The 'romance' genre does not fit either of the films based on the context provided. So, the correct option is 'documentary'. <|end|>",documentary,"The World's Best Prom is a 2006 documentary film about a high school prom in Racine, Wisconsin. ""Prom"" was released as a short film and was expanded to feature-length documentary length. It was released in its longer form on April 4, 2006. It was filmed on location in Racine and was shot entirely in digital video. This film was originally a 17-minute short film of the same name which won Best Documentary at the Wisconsin Film Festival. The film was also re-edited as mini-episodes for Truth, but the episodes never aired. Shape of the Moon (Dutch: ""Stand van de maan"" ) is a Dutch/Indonesian documentary film from 2004 directed by Leonard Retel Helmrich. The documentary released on 24 November 2004 as opening film of IDFA (International Documentary Festival Amsterdam)."
165,"Are Monastery of the Transfiguration, Kinaliada and Süreyya Opera House both Greek Orthodox monasteries? ",no," Let's analyze the options and the context given. The context mentions two different places: Süreyya Opera House and the Monastery of the Transfiguration. The Süreyya Opera House is located in Istanbul, Turkey, and it is an opera hall. The Monastery of the Transfiguration, also known as Hristo Monastery, is a Greek Orthodox monastery located on the island of Kınalıada in the Sea of Marmara.

Now, let's check the options:

1. 'yes': This option would mean that both the Monastery of the Transfiguration and the Süreyya Opera House are Greek Orthodox monasteries. However, the context clearly states that the Süreyya Opera House is an opera hall, not a monastery. Therefore, this option is incorrect.

2. 'no': This option would mean that neither the Monastery of the Transfiguration nor the Süreyya Opera House are Greek Orthodox monasteries. This is also incorrect, as the Monastery of the Transfiguration is indeed a Greek Orthodox monastery.

Based on the context, the correct answer is 'no', as only the Monastery of the Transfiguration is a Greek Orthodox monastery, while the Süreyya Opera House is an opera hall. <|end|>",no,"Süreyya Opera House, also called Süreyya Cultural Center (Turkish: ""Süreyya Operası or Süreyya Kültür Merkezi"" ), is an opera hall located in Kadıköy district of Istanbul, Turkey. The building is designed by Armenian architect Kegam Kavafyan by order of a Deputy for Istanbul Süreyya İlmen, it was originally established in 1927 as the first musical theatre on the Anatolian part of Istanbul. However, due to lack of appropriate facilities and equipment in the theatre, operettas were never staged. The venue was rather used as a movie theatre until the building underwent a functional restoration and reopened as an opera house by the end of 2007. The Monastery of the Transfiguration, known locally as Hristo [Christ] Monastery, is a prominent Greek Orthodox monastery that has served the Greek Orthodox community of Constantinople (modern Istanbul) since the time of the Byzantine Empire. The monastery is located on the island of Kınalıada, one of the Prince Islands in the Sea of Marmara. It is situated on one of the highest peaks on the island called Hristo Peak (93 meters), which is named after the Monastery. The Monastery is especially known as a destination for exiled Byzantine Emperors in the 11th century."
166,"Which of these has its entrance in Piyer Loti Caddesi, Hagia Sophia or Theodosius Cistern?",theodosius cistern," Let's consider the options and check whether or not they are correct. The context mentions that the entrance to the Theodosius Cistern is in Piyer Loti Caddesi, Fatih. Therefore, 'Theodosius Cistern' is the correct option. 'Hagia Sophia' is not mentioned in the context as having its entrance in Piyer Loti Caddesi, Fatih. Thus, the correct option is 'Theodosius Cistern'. <|end|>",theodosius cistern,"Hagia Sophia ( ; from the Greek: Αγία Σοφία , ] , ""Holy Wisdom""; Latin: ""Sancta Sophia"" or ""Sancta Sapientia""; Turkish: ""Ayasofya"" ) was a Greek Orthodox Christian patriarchal basilica (church), later an imperial mosque, and is now a museum (Ayasofya Müzesi) in Istanbul, Turkey. The Roman Empire's first Christian Cathedral, from the date of its construction in 537 AD, and until 1453, it served as an Eastern Orthodox cathedral and seat of the Patriarch of Constantinople, except between 1204 and 1261, when it was converted by the Fourth Crusaders to a Roman Catholic cathedral under the Latin Empire. The building was later converted into an Ottoman mosque from 29 May 1453 until 1931. It was then secularized and opened as a museum on 1 February 1935. Famous in particular for its massive dome, it is considered the epitome of Byzantine architecture and is said to have ""changed the history of architecture"". It remained the world's largest cathedral for nearly a thousand years, until Seville Cathedral was completed in 1520. The Theodosius Cistern (Greek: Κινστέρνα Θεοδοσίου , Turkish: Şerefiye Sarnıcı ) is one of many ancient cisterns of Constantinople that lie beneath the city of Istanbul, Turkey. The modern entrance is in Piyer Loti Caddesi, Fatih."
167,Reader's Digest and Scientific American are both what?,magazine," Let's analyze the options and the context provided. The context describes Reader's Digest as an ""American general-interest family magazine, published ten times a year."" This information aligns with the definition of a magazine, which is a periodical publication containing articles, stories, and advertisements.

On the other hand, Scientific American is described as an ""American popular science magazine."" This description also matches the definition of a magazine, as it is a periodical publication containing articles, stories, and advertisements.

Based on the context provided, both Reader's Digest and Scientific American are described as magazines. Therefore, the correct option is'magazine'. <|end|>",magazine,"Reader's Digest is an American general-interest family magazine, published ten times a year. Formerly based in Chappaqua, New York, it is now headquartered in Midtown Manhattan. The magazine was founded in 1920, by DeWitt Wallace and Lila Bell Wallace. For many years, ""Reader's Digest"" was the best-selling consumer magazine in the United States; it lost the distinction in 2009 to ""Better Homes and Gardens"". According to Mediamark Research (2006), ""Reader's Digest"" reaches more readers with household incomes of $100,000+ than ""Fortune"", ""The Wall Street Journal"", ""Business Week"", and ""Inc."" combined. Scientific American (informally abbreviated SciAm) is an American popular science magazine. Many famous scientists, including Albert Einstein, have contributed articles in the past 170 years. It is the oldest continuously published monthly magazine in the United States(though it only became monthly in 1921)."
168,Waht kind of music do the bands Nada Surf and Madina Lake play?,alternative rock," Let's analyze the options and the context. The context mentions that both Nada Surf and Madina Lake are American alternative rock bands. Nada Surf is described as an ""American alternative rock band"" and Madina Lake is also described as an ""American alternative rock band"". Therefore, the correct option is 'alternative rock'. <|end|>",alternative rock,"Nada Surf is an American alternative rock band which currently consists of Matthew Caws (guitar, vocals), Ira Elliot (drums), Doug Gillard (guitar) and Daniel Lorca (bass, backing vocals). Based in New York City and formed in the 1990s, Nada Surf continues to tour. Their eighth album, ""You Know Who You Are"", was a featured release on NPR in February 2016. Madina Lake is an American alternative rock band formed in Chicago in 2005. Madina Lake released their debut album ""From Them, Through Us, to You"" through Roadrunner Records on March 27, 2007. Madina Lake won Best International Newcomer at the Kerrang! Awards 2007. The group disbanded in September 2013 before reuniting in February 2017."
169,"Which documentary, Crumb or Cancer, was produced first?",crumb," To answer this question, we need to compare the release dates of the two documentaries. According to the context, Crumb was released in the USA on April 28, 1995, after being screened at film festivals the previous year. On the other hand, Cancer: The Emperor of All Maladies was released in 2015. Therefore, the documentary 'Crumb' was produced first. So, the correct option is 'Crumb'. <|end|>",crumb,"Crumb is a 1994 documentary film about the noted underground cartoonist Robert Crumb (R. Crumb) and his family. Directed by Terry Zwigoff and produced by Lynn O'Donnell, it won widespread acclaim. It was released in the USA on April 28, 1995, having been screened at film festivals the previous year. Jeffery M. Anderson (later critic for the ""San Francisco Examiner"") placed the film on his list of the ten greatest films of all time, labeling it ""the greatest documentary ever made."" Cancer: The Emperor of All Maladies is a 2015 American documentary film directed by Barak Goodman and produced by Ken Burns. The film, in three-episodes of two hours each, is based on the Pulitzer Prize winning 2010 book, """", by Siddhartha Mukherjee, and describes the history of cancer, and cancer treatments, particularly in the United States."
170,"Which man, Ben Bagdikian or Eddie Mekka, is most famous for his role as Carmine The Big Ragu Ragusa on the sitcom Laverne & Shirley?",eddie mekka," Let's analyze the options and the context provided. The context states that Eddie Mekka is most famous for his role as Carmine ""The Big Ragu"" Ragusa on the sitcom ""Laverne & Shirley"". This directly matches with the first option, 'Eddie Mekka'. The second option, 'Ben Bagdikian', is mentioned in the context as an educator and journalist, but there is no mention of him playing a role in a sitcom. Therefore, the correct option is 'Eddie Mekka'. <|end|>",eddie mekka,"Eddie Mekka (born June 14, 1952) is an American actor most famous for his role as Carmine ""The Big Ragu"" Ragusa on the sitcom ""Laverne & Shirley"". Ben Haig Bagdikian (January 30, 1920 – March 11, 2016) was an Armenian-American educator and journalist. He was a significant American media critic and the dean of the University of California, Berkeley Graduate School of Journalism."
171,"Are Beyazıt Tower and Miniatürk both in Istanbul, Turkey?",yes," Let's analyze the context and the options. The context mentions that Miniatürk is located in Istanbul, Turkey. It also mentions that Beyazıt Tower is located in Istanbul, Turkey. Therefore, both Beyazıt Tower and Miniatürk are indeed in Istanbul, Turkey. So, the correct option is 'yes'. <|end|>",yes,"Miniatürk is a miniature park situated at the north-eastern shore of Golden Horn in Istanbul, Turkey. It was opened May 2, 2003. Miniatürk covers a total area of 60000 m2 . It is one of the world's largest miniature parks with its 15000 m2 model area. The park contains 122 models in 1:25 scale. It contains structures from in and around Turkey, as well as interpretations of historic structures. Beyazıt Tower, also named Seraskier Tower, from the name of the Ottoman ministry of War, is an 85 m tall fire-watch tower located in the courtyard of Istanbul University's main campus (formerly Ottoman Ministry of War) on Beyazıt Square (known as the Forum Tauri in the Roman period) in Istanbul, Turkey, on top of one of the ""seven hills"" which Constantine the Great had built the city, following the model of Rome."
172,Which happened first Battle of Okinawa or Operation Nordwind ?,operation north wind," To answer this question, we need to compare the dates of the Battle of Okinawa and Operation Nordwind. The Battle of Okinawa lasted from April 1, 1945, to June 22, 1945. On the other hand, Operation Nordwind started on December 31, 1944, and ended on January 25, 1945.

Comparing these dates, we can see that Operation Nordwind happened first, as it started before the Battle of Okinawa. Therefore, the correct option is 'Operation Nordwind'. <|end|>",operation nordwind,"The Battle of Okinawa (Japanese: 沖縄戦 , Hepburn: Okinawa-sen ) (Okinawan: 沖縄戦 , ""Uchinaa ikusa "" ), codenamed Operation Iceberg, was a major battle of the Pacific War fought on the island of Okinawa by United States Marine and Army forces against the Imperial Japanese Army and included the largest amphibious assault in the Pacific War during World War II, the April 1, 1945, invasion of Okinawa itself. The 82-day battle lasted from April 1 until June 22, 1945. After a long campaign of island hopping, the Allies were planning to use Okinawa, a large island only 340 mi away from mainland Japan, as a base for air operations for the planned invasion of the Japanese home islands. Operation North Wind (German: ""Unternehmen Nordwind"" ) was the last major German offensive of World War II on the Western Front. It began on 31 December 1944 in Alsace and Lorraine in northeastern France, and ended on 25 January."
173,Ezhou and Yangzhong are both cities in what country?,china," Assistant: Let's analyze the options and the context. The context clearly states that both Yangzhong and Ezhou are located in China. Yangzhong is a county-level city under the administration of Zhenjiang, Jiangsu province, and Ezhou is a prefecture-level city in eastern Hubei Province, both in China. Therefore, the correct option is 'China'. <|end|>",china,"Yangzhong () is a county-level city under the administration of Zhenjiang, Jiangsu province, China. It is the easternmost county-level division of Zhenjiang City. Ezhou () is a prefecture-level city in eastern Hubei Province, China. As of the 2010 census, the city had a population of 1,048,668, of which 668,727 lived in the core Echeng District. The Ezhou - Huanggang built-up (""or metro"") area was home to 1,035,496 inhabitants from the Echeng and Huangzhou, Huanggang Districts."
174,"Editors and Working for a Nuclear Free City, is of which nationality?",english," Assistant: The context provides information about two bands, one being 'Editors' and the other 'Working for a Nuclear Free City'. The Editors are described as an 'English rock band', which indicates that they are of English nationality. The band 'Working for a Nuclear Free City' is described as being from 'Manchester, England', which also indicates that they are of English nationality. Therefore, the correct option is 'English'. <|end|>",english,"Editors are an English rock band, formed in 2002 in Birmingham. Previously known as Pilot, The Pride and Snowfield, the band currently consists of Tom Smith (lead vocals, guitar, piano), Russell Leetch (bass guitar, synthesizer, backing vocals), Ed Lay (drums, percussion, backing vocals), Justin Lockey (lead guitar), and Elliott Williams (keys, synthesizers, guitars, and backing vocals). Working for a Nuclear Free City (sometimes abbreviated to WFANFC) was an indie nu gaze band from Manchester, England."
175,What type of film are Transparent and Werner Herzog Eats His Shoe?,documentary," Let's analyze the options and the context. The context mentions that ""Werner Herzog Eats His Shoe"" is a short documentary film directed by Les Blank. It also mentions ""Transparent"" as a 2005 documentary film written, directed, and produced by Jules Rosskam. Both films are clearly identified as documentaries in the context. Therefore, the correct option is 'documentary'. <|end|>",documentary,"Werner Herzog Eats His Shoe is a short documentary film directed by Les Blank in 1980 which depicts director Werner Herzog living up to his promise that he would eat his shoe if Errol Morris ever completed the film ""Gates of Heaven"". The film includes clips from both ""Gates of Heaven"" and Herzog's 1970 feature ""Even Dwarfs Started Small"". Comic song ""Old Whisky Shoes"", played by the Walt Solek Band, is the signature tune over the opening and closing credits. Transparent is a 2005 documentary film written, directed, and produced by Jules Rosskam. Its title is a play on the words “trans” and “parent” implying the invisibility of transgender parenting in society today. The documentary follows 19 female-to-male transsexuals from 14 different states who have given birth to, and in most cases, gone on to raise, their biological children and the challenges they face while transitioning."
176,"What band was formed earlier, Better Than Ezra or the Melvins?",melvins," Let's consider the options and check whether or not they are correct. The context clearly states that the Melvins were formed in 1983, while Better Than Ezra was formed in 1988. Therefore, the Melvins were formed earlier than Better Than Ezra. So, the correct option is 'Melvins'. <|end|>",melvins,"The Melvins are an American rock band that formed in 1983 in Montesano, Washington. They have mostly performed as a trio, as well as a quartet with two drummers in recent years. Since 1984, vocalist and guitarist Buzz Osborne and drummer Dale Crover have been constant members. The band was named after a supervisor at a Thriftway in Montesano, Washington, where Osborne also worked as a clerk. ""Melvin"" was despised by other employees, and the band's members felt it to be an appropriately ridiculous name. Their early work was key to the development of both grunge and sludge metal. Better Than Ezra is an American alternative rock band based in New Orleans, Louisiana, and signed to The End Records. The band formed in 1988 in Baton Rouge, Louisiana. The current band consists of Kevin Griffin (vocals and guitar), Tom Drummond (bass guitar), and Michael Jerome (drums). The band has released 8 studio albums, the most recent one being 2014's ""All Together Now."" They are best known for their 1993 platinum album ""Deluxe"" and the 1995 single ""Good"", which hit no. 1 on the Hot Modern Rocks Tracks charts."
